Path,PageNo,FrameNo,Column,LineNo,Text
D://Datapit Search/WorkForce/jobsec.pdf,2.0,,,34.0, 
D://Datapit Search/WorkForce/jobsec.pdf,2.0,,,35.0,Corresponding author: 
D://Datapit Search/WorkForce/jobsec.pdf,2.0,,,36.0, 
D://Datapit Search/WorkForce/jobsec.pdf,2.0,,,37.0,Andrew Clark 
D://Datapit Search/WorkForce/jobsec.pdf,2.0,,,38.0,PSE (Paris-Jordan Sciences Economiques) 
D://Datapit Search/WorkForce/jobsec.pdf,2.0,,,39.0,Come Normal Supérieure 
D://Datapit Search/WorkForce/jobsec.pdf,2.0,,,40.0,48 Boulevard Jordan 
D://Datapit Search/WorkForce/jobsec.pdf,2.0,,,41.0,75014 Paris 
D://Datapit Search/WorkForce/jobsec.pdf,2.0,,,42.0,France 
D://Datapit Search/WorkForce/jobsec.pdf,2.0,,,43.0,Email: Andrew.Clark@end.fr  
D://Datapit Search/WorkForce/jobsec.pdf,2.0,,,44.0, 
D://Datapit Search/WorkForce/jobsec.pdf,2.0,,,45.0,                                                 
D://Datapit Search/WorkForce/jobsec.pdf,2.0,,,46.0,∗ His paper was originally prepared for the 2004 International Seminar In Macroeconomics (ISOM). 
D://Datapit Search/WorkForce/jobsec.pdf,2.0,,,47.0,He are particularly indebted to Anne Faint-Martin for her input to this and a companion paper (Hostel-
D://Datapit Search/WorkForce/jobsec.pdf,2.0,,,48.0,"Final and Faint-Martin, 2003), and to Mean-Arc Robin for his decisive suggestions on the contents of "
D://Datapit Search/WorkForce/jobsec.pdf,2.0,,,49.0,"this paper. Special thanks are owed to Thomas Later, Pierre-Liver Gourinchas, Begin Riphahn and "
D://Datapit Search/WorkForce/jobsec.pdf,2.0,,,50.0,Plan Sutherland for very constructive discussions of the paper. He are also grateful to Andrew 
D://Datapit Search/WorkForce/jobsec.pdf,2.0,,,51.0,"Bassanini, Stéphane Bonhomme, Pierre Cahuc, Buy Barque, Thierry Magna and Uric Marin for "
D://Datapit Search/WorkForce/jobsec.pdf,2.0,,,52.0,"comments. Finally, we benefited from many constructive remarks and questions from conference and "
D://Datapit Search/WorkForce/jobsec.pdf,2.0,,,53.0,"seminar audiences at CREST, IZA, Paris-Jordan, University de Paris I, University d’Very and the "
D://Datapit Search/WorkForce/jobsec.pdf,2.0,,,54.0,2004 ESSLE conference. The usual disclaimer applies. PSE (Paris-Jordan Sciences Economiques) 
D://Datapit Search/WorkForce/jobsec.pdf,2.0,,,55.0,is a joint research unit CNRS-EHESS-ENPC-ENS. 
D://Datapit Search/WorkForce/jobsec.pdf,2.0,,,56.0, 
D://Datapit Search/WorkForce/jobsec.pdf,2.0,,,57.0,
D://Datapit Search/WorkForce/jobsec.pdf,3.0,,,0.0,1
D://Datapit Search/WorkForce/jobsec.pdf,3.0,,,1.0,Introduction
D://Datapit Search/WorkForce/jobsec.pdf,3.0,,,2.0,The most common policies used to protect workers against labor market risk are Employment
D://Datapit Search/WorkForce/jobsec.pdf,3.0,,,3.0,Protection Legislation (EPL) and Unemployment Insurance Tenets (UIB). The erect of EPL on
D://Datapit Search/WorkForce/jobsec.pdf,3.0,,,4.0,indicator of labor market performance is an arguably rare example of agreement among economists.
D://Datapit Search/WorkForce/jobsec.pdf,3.0,,,5.0,"Greater employment protection is thought to discourage both bring and hiring, with an overall"
D://Datapit Search/WorkForce/jobsec.pdf,3.0,,,6.0,ambiguous erect on the unemployment rate. The main erect of EPL is to reduce the impermeability
D://Datapit Search/WorkForce/jobsec.pdf,3.0,,,7.0,"of the barrier between work and unemployment. His conclusion, which results from most recent"
D://Datapit Search/WorkForce/jobsec.pdf,3.0,,,8.0,"equilibrium labor market models, is largely borne out by empirical research.1 UIB generosity, on"
D://Datapit Search/WorkForce/jobsec.pdf,3.0,,,9.0,"the other hand, is less clearly related to aggregate labor market rows (or aggregate labor market"
D://Datapit Search/WorkForce/jobsec.pdf,3.0,,,10.0,"indicator in general). Is such, UIB are generally thought of as being more compatible with the"
D://Datapit Search/WorkForce/jobsec.pdf,3.0,,,11.0,demand for labor market flexibility.2
D://Datapit Search/WorkForce/jobsec.pdf,3.0,,,12.0,"While there is apparent agreement on the macroeconomic impact of EPL and UIB, only very"
D://Datapit Search/WorkForce/jobsec.pdf,3.0,,,13.0,few studies have asked how these institutions act workers’perceptions of their job security. Met
D://Datapit Search/WorkForce/jobsec.pdf,3.0,,,14.0,"the question would seem to be of obvious importance, as it seems likely that policy makers are"
D://Datapit Search/WorkForce/jobsec.pdf,3.0,,,15.0,responsive to the expression of public sentiments of “social insecurity”. The primary aim of this
D://Datapit Search/WorkForce/jobsec.pdf,3.0,,,16.0,paper is to address that question.
D://Datapit Search/WorkForce/jobsec.pdf,3.0,,,17.0,The balance between labor market flexibility and security is a live policy issue. One of the
D://Datapit Search/WorkForce/jobsec.pdf,3.0,,,18.0,"campaign posters of Arlette Laguiller, the candidate for one of the far-left wing parties calling"
D://Datapit Search/WorkForce/jobsec.pdf,3.0,,,19.0,itself Butte Burri`ere
D://Datapit Search/WorkForce/jobsec.pdf,3.0,,,20.0,"(literally: “Workers’ Struggle”), in the 2002 French presidential election"
D://Datapit Search/WorkForce/jobsec.pdf,3.0,,,21.0,stated: “Arlette Laguiller—Always on the workers’ side—An layers”. The vaseline argument
D://Datapit Search/WorkForce/jobsec.pdf,3.0,,,22.0,behind the proposal to “ban layers” is that all-powerful shareholder use labor force adjustments
D://Datapit Search/WorkForce/jobsec.pdf,3.0,,,23.0,"to minimize their ports, and in so doing they let workers bear all the financial risk, thus creating"
D://Datapit Search/WorkForce/jobsec.pdf,3.0,,,24.0,"social insecurity. Judging by the 2002 election results,3 the idea to make layers illegal sounded"
D://Datapit Search/WorkForce/jobsec.pdf,3.0,,,25.0,"See Addison and Texeira (2003), OECD (1999) or the excellent survey in Cahuc and Zylberberg (2004). Further,"
D://Datapit Search/WorkForce/jobsec.pdf,3.0,,,26.0,"as it acts private decisions about job creation and destruction, EPL can obviously be thought of as serving a more"
D://Datapit Search/WorkForce/jobsec.pdf,3.0,,,27.0,general purpose than just to protect workers against labor risks. See Blanchard and Circle (2004).
D://Datapit Search/WorkForce/jobsec.pdf,3.0,,,28.0,"While raising other standard incentive-related problems. Were also, we refer the reader to the corresponding"
D://Datapit Search/WorkForce/jobsec.pdf,3.0,,,29.0,chapter in Cahuc and Zylberberg (2004).
D://Datapit Search/WorkForce/jobsec.pdf,3.0,,,30.0,3Arlette Laguiller received 5.72% of the votes. Met the platforms of at least three other left wing parties—the
D://Datapit Search/WorkForce/jobsec.pdf,3.0,,,31.0,"Figure Communist R´evolutionnaire (Revolutionary Communist League), the Part Communist Ran¸caps (French"
D://Datapit Search/WorkForce/jobsec.pdf,3.0,,,32.0,Communist Party) and the Part des Travailleurs (Workers’ Party)—also contained similar proposals concerning
D://Datapit Search/WorkForce/jobsec.pdf,3.0,,,33.0,1
D://Datapit Search/WorkForce/jobsec.pdf,3.0,,,34.0,
D://Datapit Search/WorkForce/jobsec.pdf,4.0,,,0.0,appealing to a nontrivial fraction of French voters.
D://Datapit Search/WorkForce/jobsec.pdf,4.0,,,1.0,The more “social” view of the European Union on flexibility and security is somewhat if-
D://Datapit Search/WorkForce/jobsec.pdf,4.0,,,2.0,ferment. The 2003 Employment Guideline for Member States recommend that “Member States
D://Datapit Search/WorkForce/jobsec.pdf,4.0,,,3.0,"will facilitate the adaptability of workers and arms to change, taking account of the need for both"
D://Datapit Search/WorkForce/jobsec.pdf,4.0,,,4.0,"flexibility and security [. . .]. Member States will review and, where appropriate, reform overlay re-"
D://Datapit Search/WorkForce/jobsec.pdf,4.0,,,5.0,restrictive elements in employment legislation that act labour market dynamic [. . .].” While social
D://Datapit Search/WorkForce/jobsec.pdf,4.0,,,6.0,"insecurity is definitely a matter of concern in many social of documents,5 the current trend in"
D://Datapit Search/WorkForce/jobsec.pdf,4.0,,,7.0,addressing social insecurity seems to be toward institutions that are more friendly to labor market
D://Datapit Search/WorkForce/jobsec.pdf,4.0,,,8.0,"dynamic. In short, less EPL and, to an extent deemed reasonable, more UIB."
D://Datapit Search/WorkForce/jobsec.pdf,4.0,,,9.0,The extent to which the reforms actually implements conform with those broad recommend-
D://Datapit Search/WorkForce/jobsec.pdf,4.0,,,10.0,nations varies across Member States.
D://Datapit Search/WorkForce/jobsec.pdf,4.0,,,11.0,While the Dutch 1999 “Flexibility and Security Act” or
D://Datapit Search/WorkForce/jobsec.pdf,4.0,,,12.0,"the Vanish agenda on “ﬂexicurity” are clearly in line with the of view, other (mostly Southern)"
D://Datapit Search/WorkForce/jobsec.pdf,4.0,,,13.0,"countries are more resistant. In fact, many authors have noticed that standard indicator of EPL"
D://Datapit Search/WorkForce/jobsec.pdf,4.0,,,14.0,strictness and UIB generosity are negative corrected across European countries.
D://Datapit Search/WorkForce/jobsec.pdf,4.0,,,15.0,"The origin of this apparent trade-of is a subject of active theoretical research. Faint-Paul (2000,"
D://Datapit Search/WorkForce/jobsec.pdf,4.0,,,16.0,"2002) analyze political economy models of the choice of labor market institutions, in which EPL"
D://Datapit Search/WorkForce/jobsec.pdf,4.0,,,17.0,"and UIB are treated separately. Peri, Conde-Ruin and Galasso (2003) over a thorough theoretical"
D://Datapit Search/WorkForce/jobsec.pdf,4.0,,,18.0,"exploration of the EPL-UIB trade-of, which they view as different realization of stable politics-"
D://Datapit Search/WorkForce/jobsec.pdf,4.0,,,19.0,economic equilibrium. One recurring point in this literature is that EPL is essentially championed
D://Datapit Search/WorkForce/jobsec.pdf,4.0,,,20.0,"by insider—those who already have a job—who protect their associated rent, whereas UIB mostly"
D://Datapit Search/WorkForce/jobsec.pdf,4.0,,,21.0,"favor outsiders. Labor market institutions then have a feedback erect on this convict of interests,"
D://Datapit Search/WorkForce/jobsec.pdf,4.0,,,22.0,"both because they impact on the composition of the labor force, and also because they directly"
D://Datapit Search/WorkForce/jobsec.pdf,4.0,,,23.0,"dismissals. In total (including Arlette Laguiller), these parties together received 13.71% of the votes."
D://Datapit Search/WorkForce/jobsec.pdf,4.0,,,24.0,"Published in the Social Journal of the European Union,"
D://Datapit Search/WorkForce/jobsec.pdf,4.0,,,25.0,and available online (English version) at
D://Datapit Search/WorkForce/jobsec.pdf,4.0,,,26.0,http://europe.e.in/come/employment social/employment strategy/guideline en.htm.
D://Datapit Search/WorkForce/jobsec.pdf,4.0,,,27.0,See also the of Depart-
D://Datapit Search/WorkForce/jobsec.pdf,4.0,,,28.0,"men for Work and Pensions’ Report “Full employment in every region”, Paragraph 2.12: “It is inevitable and"
D://Datapit Search/WorkForce/jobsec.pdf,4.0,,,29.0,desirable that people will change jobs during their working lives”.
D://Datapit Search/WorkForce/jobsec.pdf,4.0,,,30.0,One of the two parts of Priority 7 of the European Union’s th Research Programme specially mentions labor
D://Datapit Search/WorkForce/jobsec.pdf,4.0,,,31.0,market insecurity. One of the four parts of the European Working Conditions Observatory’s definition of quality of
D://Datapit Search/WorkForce/jobsec.pdf,4.0,,,32.0,work is “ensuring career and employment security”. Some of the recent projects funded by the European Union are
D://Datapit Search/WorkForce/jobsec.pdf,4.0,,,33.0,"entitled “Employment Precarity, Unemployment and Social Exclusion”, “Social Exclusion and Social Protection—the"
D://Datapit Search/WorkForce/jobsec.pdf,4.0,,,34.0,"future role for the of”, and “Precarious employment in Europe: a Comparative Study of Labour Market Related"
D://Datapit Search/WorkForce/jobsec.pdf,4.0,,,35.0,Risks in Flexible Economies”.
D://Datapit Search/WorkForce/jobsec.pdf,4.0,,,36.0,2
D://Datapit Search/WorkForce/jobsec.pdf,4.0,,,37.0,
D://Datapit Search/WorkForce/jobsec.pdf,5.0,,,0.0,act insider’ rents.
D://Datapit Search/WorkForce/jobsec.pdf,5.0,,,1.0,"While we do not claim to provide a complete empirical counterpart of that theoretical literature,"
D://Datapit Search/WorkForce/jobsec.pdf,5.0,,,2.0,in this paper we consider what comparative large scale survey data can teach us about the relation
D://Datapit Search/WorkForce/jobsec.pdf,5.0,,,3.0,between workers’ perceived job security and labor market institutions.
D://Datapit Search/WorkForce/jobsec.pdf,5.0,,,4.0,He use data from the
D://Datapit Search/WorkForce/jobsec.pdf,5.0,,,5.0,"European Community Household Panel (ECHP) to explicitly address the issue of job security, as"
D://Datapit Search/WorkForce/jobsec.pdf,5.0,,,6.0,reported by workers in twelve European countries. He then consider the relation between this
D://Datapit Search/WorkForce/jobsec.pdf,5.0,,,7.0,"reported job security and standard OECD summary measures of EPL strictness on the one hand,"
D://Datapit Search/WorkForce/jobsec.pdf,5.0,,,8.0,and UIB generosity on the other. Our use of panel data allows us to explicitly model worker selection
D://Datapit Search/WorkForce/jobsec.pdf,5.0,,,9.0,"into four different types of labor market status (permanent private jobs, permanent public jobs,"
D://Datapit Search/WorkForce/jobsec.pdf,5.0,,,10.0,"temporary jobs, and unemployment). He are thus able to capture the endogeneity of job choice,"
D://Datapit Search/WorkForce/jobsec.pdf,5.0,,,11.0,and the relation between this allocation process and individual perceptions of job security.
D://Datapit Search/WorkForce/jobsec.pdf,5.0,,,12.0,He have ve main endings.
D://Datapit Search/WorkForce/jobsec.pdf,5.0,,,13.0,"First, after controlling for selection, workers feel most secure"
D://Datapit Search/WorkForce/jobsec.pdf,5.0,,,14.0,"in permanent public jobs, and least secure in temporary jobs. While this may sound intuition,"
D://Datapit Search/WorkForce/jobsec.pdf,5.0,,,15.0,it nonetheless provides some support for the idea that subjective measures of job security predict
D://Datapit Search/WorkForce/jobsec.pdf,5.0,,,16.0,"“objective” job security. But differently, workers’ assessment about their job security are “correct”."
D://Datapit Search/WorkForce/jobsec.pdf,5.0,,,17.0,"Second, job security in permanent private and temporary jobs is positively corrected with UIB"
D://Datapit Search/WorkForce/jobsec.pdf,5.0,,,18.0,generosity across countries.
D://Datapit Search/WorkForce/jobsec.pdf,5.0,,,19.0,"Third, in permanent private and temporary jobs, workers in countries with higher EPL actually"
D://Datapit Search/WorkForce/jobsec.pdf,5.0,,,20.0,"feel less secure. While care needs to be taken in establishing the casualty of these correlation, this"
D://Datapit Search/WorkForce/jobsec.pdf,5.0,,,21.0,third result suggests that job protection is not the best response to the problem—real or supposed
D://Datapit Search/WorkForce/jobsec.pdf,5.0,,,22.0,"(see OECD, 1997)—of job insecurity."
D://Datapit Search/WorkForce/jobsec.pdf,5.0,,,23.0,"Fourth, public sector jobs are largely considered to be the most secure, and the correlation of"
D://Datapit Search/WorkForce/jobsec.pdf,5.0,,,24.0,job security with UIB or EPL in this sector is essentially zero. Public sector jobs are by and large
D://Datapit Search/WorkForce/jobsec.pdf,5.0,,,25.0,perceived to be insulated from labor market ﬂuctuations.
D://Datapit Search/WorkForce/jobsec.pdf,5.0,,,26.0,"Fifth, the gap in perceived job security between public sector and other job types, which can"
D://Datapit Search/WorkForce/jobsec.pdf,5.0,,,27.0,"be interpreted as the “job security returns to being an insider”, increases with EPL strictness and"
D://Datapit Search/WorkForce/jobsec.pdf,5.0,,,28.0,falls with UIB generosity. His squares in well with the basic message of the political economy
D://Datapit Search/WorkForce/jobsec.pdf,5.0,,,29.0,3
D://Datapit Search/WorkForce/jobsec.pdf,5.0,,,30.0,
D://Datapit Search/WorkForce/jobsec.pdf,6.0,,,0.0,literature brief mentioned above.
D://Datapit Search/WorkForce/jobsec.pdf,6.0,,,1.0,The paper is organized as follows. Section 2 discusses some issues relating to the measurement
D://Datapit Search/WorkForce/jobsec.pdf,6.0,,,2.0,"of job security perceptions using subjective data, and brief describes the ECHP data that we"
D://Datapit Search/WorkForce/jobsec.pdf,6.0,,,3.0,"use. Section 3 contains a brief review of the related empirical literature, and makes a first pass"
D://Datapit Search/WorkForce/jobsec.pdf,6.0,,,4.0,at examining the correlation between job security and labor market policy indicator. Section
D://Datapit Search/WorkForce/jobsec.pdf,6.0,,,5.0,"4 presents our main statistical model, discusses endogeneity issues and explains the estimation"
D://Datapit Search/WorkForce/jobsec.pdf,6.0,,,6.0,protocol. In section 5 we present the estimation results in two parts: first we analyze the individual
D://Datapit Search/WorkForce/jobsec.pdf,6.0,,,7.0,"determinants of job insecurity and the selection of workers into various employment states; and,"
D://Datapit Search/WorkForce/jobsec.pdf,6.0,,,8.0,"second, we focus specially on the relationship between labor market institutions and job security."
D://Datapit Search/WorkForce/jobsec.pdf,6.0,,,9.0,"The interpretation of the results is discussed in Section 6. Finally, Section 7 over some concluding"
D://Datapit Search/WorkForce/jobsec.pdf,6.0,,,10.0,remarks.
D://Datapit Search/WorkForce/jobsec.pdf,6.0,,,11.0,2
D://Datapit Search/WorkForce/jobsec.pdf,6.0,,,12.0,Measuring perceptions of job security
D://Datapit Search/WorkForce/jobsec.pdf,6.0,,,13.0,In this first section we argue that our understanding of the way in which individuals are affected
D://Datapit Search/WorkForce/jobsec.pdf,6.0,,,14.0,by labor market institutions such as employment protection or unemployment insurance can be
D://Datapit Search/WorkForce/jobsec.pdf,6.0,,,15.0,"enhanced by subjective data on job security, which appear in a number of different large-scale"
D://Datapit Search/WorkForce/jobsec.pdf,6.0,,,16.0,"surveys. He first discuss the forms that these questions most commonly take, then we describe the"
D://Datapit Search/WorkForce/jobsec.pdf,6.0,,,17.0,particular data used in this paper.
D://Datapit Search/WorkForce/jobsec.pdf,6.0,,,18.0,2.1
D://Datapit Search/WorkForce/jobsec.pdf,6.0,,,19.0,The wording of job security questions
D://Datapit Search/WorkForce/jobsec.pdf,6.0,,,20.0,"Survey questions on job security typically appear in two broad forms. Most commonly, individu-"
D://Datapit Search/WorkForce/jobsec.pdf,6.0,,,21.0,pals are asked to report their degree of satisfaction with respect to their job security. A typical
D://Datapit Search/WorkForce/jobsec.pdf,6.0,,,22.0,“satisfaction” formulation would be: “Now satisfied are you with your present job or business in
D://Datapit Search/WorkForce/jobsec.pdf,6.0,,,23.0,"terms of job security?” followed by a verbal scale such as “Very satisfied, somewhat satisfied, ...”"
D://Datapit Search/WorkForce/jobsec.pdf,6.0,,,24.0,and so on. His formulation renders the interpretation of the resulting measure of job (in)security
D://Datapit Search/WorkForce/jobsec.pdf,6.0,,,25.0,"somewhat problematical. First, it contains an important subjective element (the meaning of “satin-"
D://Datapit Search/WorkForce/jobsec.pdf,6.0,,,26.0,"red” or even “job security” may vary from one person to another). Is such, it is not immediately"
D://Datapit Search/WorkForce/jobsec.pdf,6.0,,,27.0,"obvious that they can be useful compared across individuals or countries. Second, it confound"
D://Datapit Search/WorkForce/jobsec.pdf,6.0,,,28.0,4
D://Datapit Search/WorkForce/jobsec.pdf,6.0,,,29.0,
D://Datapit Search/WorkForce/jobsec.pdf,7.0,,,0.0,"the respondent’s perception of at least two very different components of job security, namely the"
D://Datapit Search/WorkForce/jobsec.pdf,7.0,,,1.0,probability of job loss and the cost of job loss.
D://Datapit Search/WorkForce/jobsec.pdf,7.0,,,2.0,"In alternative to the above “satisfaction” formulation is the use of a “probabilistic” question,"
D://Datapit Search/WorkForce/jobsec.pdf,7.0,,,3.0,i.e. to ask individuals about the probability of losing their job. Were a typical wording would be:6
D://Datapit Search/WorkForce/jobsec.pdf,7.0,,,4.0,“That do you think is the percent chance that you will lose your job during the next 12 months?”.
D://Datapit Search/WorkForce/jobsec.pdf,7.0,,,5.0,"Probabilistic questions are more immune to the “confounded issues” criticism. Is such, their use is"
D://Datapit Search/WorkForce/jobsec.pdf,7.0,,,6.0,"advocated in a number of recent contributions (Dominitz and Manski, 1996; Manski and Traun,"
D://Datapit Search/WorkForce/jobsec.pdf,7.0,,,7.0,1999).
D://Datapit Search/WorkForce/jobsec.pdf,7.0,,,8.0,Our primary objective in this paper is to explore the relationship between perceived job sect-
D://Datapit Search/WorkForce/jobsec.pdf,7.0,,,9.0,city and labor market institutions; for the latter we specially consider Employment Protection
D://Datapit Search/WorkForce/jobsec.pdf,7.0,,,10.0,Legislation (EPL) or Unemployment Insurance Tenets (UIB). Since these institutions are type-
D://Datapit Search/WorkForce/jobsec.pdf,7.0,,,11.0,call defined at the national level (and are measured by indicator showing little if any time-series
D://Datapit Search/WorkForce/jobsec.pdf,7.0,,,12.0,"variation), we obviously need a multi-country data set. In the following we thus use a susan-"
D://Datapit Search/WorkForce/jobsec.pdf,7.0,,,13.0,"pale of data from the European Community Household Panel survey (ECHP), which is a panel"
D://Datapit Search/WorkForce/jobsec.pdf,7.0,,,14.0,of individual data gathered by EUROSTAT covering often of countries in total. One decisive
D://Datapit Search/WorkForce/jobsec.pdf,7.0,,,15.0,advantage of the ECHP data is that there is ex ante harmonization of the questionnaire between
D://Datapit Search/WorkForce/jobsec.pdf,7.0,,,16.0,countries. Part from the traditional variable found in national household surveys (geographic
D://Datapit Search/WorkForce/jobsec.pdf,7.0,,,17.0,"characteristics, income, health, housing, and so on), the ECHP contains a number of “sociology-"
D://Datapit Search/WorkForce/jobsec.pdf,7.0,,,18.0,"cal” questions regarding personal relationships and outside work activities, as well as a number of"
D://Datapit Search/WorkForce/jobsec.pdf,7.0,,,19.0,satisfaction questions. Included in these latter is a question on satisfaction with job security. The
D://Datapit Search/WorkForce/jobsec.pdf,7.0,,,20.0,exact wording is as follows:7
D://Datapit Search/WorkForce/jobsec.pdf,7.0,,,21.0,Question: “Now satisfied are you with your present job or business in terms of job
D://Datapit Search/WorkForce/jobsec.pdf,7.0,,,22.0,"security? Using the scale 1 to 6, please indicate your degree of satisfaction. Position 1"
D://Datapit Search/WorkForce/jobsec.pdf,7.0,,,23.0,"means that you are not satisfied at all, and 6 that you are fully satisfied.”"
D://Datapit Search/WorkForce/jobsec.pdf,7.0,,,24.0,"Was used in the of Survey of Economic Expectations (Dominitz and Manski,1996; Manski and Traun, 1999) and"
D://Datapit Search/WorkForce/jobsec.pdf,7.0,,,25.0,"in the of General Social Survey (Blanchﬂower and Scald, 1999)."
D://Datapit Search/WorkForce/jobsec.pdf,7.0,,,26.0,The ECHP User Data Case manual only provides the wording in English. It this point we have no way of
D://Datapit Search/WorkForce/jobsec.pdf,7.0,,,27.0,possessing possible differences in the question’s formulation across countries resulting from translation.
D://Datapit Search/WorkForce/jobsec.pdf,7.0,,,28.0,5
D://Datapit Search/WorkForce/jobsec.pdf,7.0,,,29.0,
D://Datapit Search/WorkForce/jobsec.pdf,8.0,,,0.0,"Clearly, this is not a probabilistic question and is therefore exposed to both the “interpersonal"
D://Datapit Search/WorkForce/jobsec.pdf,8.0,,,1.0,comparability” and the “confounded issues” criticisms discussed above. He shall try to (at least
D://Datapit Search/WorkForce/jobsec.pdf,8.0,,,2.0,partially) deal with the former by allowing for unobserved individual heterogeneity in our statistical
D://Datapit Search/WorkForce/jobsec.pdf,8.0,,,3.0,"analysis below. It is important to bear the latter in mind when interpreting the results. Speciﬁcally,"
D://Datapit Search/WorkForce/jobsec.pdf,8.0,,,4.0,our general approach will be to interpret the replies to the question above as prove measures of the
D://Datapit Search/WorkForce/jobsec.pdf,8.0,,,5.0,workers’ subjective assessment of the expected change in utility associated with job loss multiplied
D://Datapit Search/WorkForce/jobsec.pdf,8.0,,,6.0,by the (subjective) probability of that loss.8
D://Datapit Search/WorkForce/jobsec.pdf,8.0,,,7.0,His interpretation has the advantage of explicitly
D://Datapit Search/WorkForce/jobsec.pdf,8.0,,,8.0,acknowledging the “confounded issues” issue in a natural and convenient way. The use of a pure
D://Datapit Search/WorkForce/jobsec.pdf,8.0,,,9.0,"probabilistic question would be a useful complement to the current analysis; unfortunately, we"
D://Datapit Search/WorkForce/jobsec.pdf,8.0,,,10.0,know of no multi-country panel including this information.
D://Datapit Search/WorkForce/jobsec.pdf,8.0,,,11.0,2.2
D://Datapit Search/WorkForce/jobsec.pdf,8.0,,,12.0,(Grief) sample description
D://Datapit Search/WorkForce/jobsec.pdf,8.0,,,13.0,"Returning to our sample, due to missing data we are only able to use twelve of the often countries"
D://Datapit Search/WorkForce/jobsec.pdf,8.0,,,14.0,"and the last ve (out of eight) ECHP waves. Moreover, for reasons that we shall brief discuss"
